{
  "product_id": "a1b2c3d4-e5f6-4a5b-8c9d-0e1f2a3b4c5d",
  "category_path": ["Electronics", "Mobile", "Smartphones"],
  "attributes": {
    "os": "Android 14",
    "screen_size": "6.7 inches",
    "5g_ready": true,
    "internal_logs": {
      "last_stock_sync": "2024-03-20T10:00:00Z",
      "warehouse_id": "WH-BR-01"
    }
  },
  "reviews": [
    {
      "review_id": "rev_9988",
      "score": 5,
      "comment": "Excelente duración de batería, muy recomendado.",
      "created_at": "2024-02-15T14:20:00Z"
    }
  ],
  "analytics_summary": {
    "view_count": 12540,
    "average_score": 4.8,
    "total_sold": 350
  }
}